{
   "labels": {
      "consumer": {
         "costCenter": "cs-foo",
         "manager": "Tom Ripen",
         "team": "team-foo"
      },
      "provider": {
         "awsAccount": "aws-account-foo",
         "pricingPlan": "PREMIUM",
         "region": "us-east-1"
      }
   },
   "name": "namespace-foo",
   "quotas": {
      "projects": {
         "limit": 75,
         "used": 14
      },
      "repositories": {
         "limit": 100,
         "used": 23
      },
      "storage": {
         "limit": 548298572358,
         "used": 580324752
      }
   },
   "status": "active"
}
